{
  "version": 2,
  "kind": "state",
  "source_kind": "synthetic",
  "station_id": "station-00",
  "scene_sha256": "0000000000000000000000000000000000000000000000000000000000000000",
  "reset_snapshot_sha256": "1111111111111111111111111111111111111111111111111111111111111111",
  "session_id": "aaaaaaaaaaaaaaaaaaaaaaaaaaaaaaaa",
  "seq": 0,
  "host_monotonic_ns": "0",
  "sim_time": 0,
  "sim_step": 0,
  "joint_names": [
    "joint_00",
    "joint_01",
    "joint_02",
    "joint_03",
    "joint_04",
    "joint_05",
    "joint_06",
    "joint_07",
    "joint_08",
    "joint_09",
    "joint_10",
    "joint_11",
    "joint_12",
    "joint_13",
    "joint_14",
    "joint_15",
    "joint_16",
    "joint_17",
    "joint_18",
    "joint_19",
    "joint_20",
    "joint_21",
    "joint_22",
    "joint_23",
    "joint_24",
    "joint_25",
    "joint_26",
    "joint_27",
    "joint_28",
    "joint_29",
    "joint_30",
    "joint_31",
    "joint_32",
    "joint_33",
    "joint_34",
    "joint_35",
    "joint_36",
    "joint_37",
    "joint_38",
    "joint_39",
    "joint_40",
    "joint_41",
    "joint_42"
  ],
  "joint_positions": [
    0,
    0,
    0,
    0,
    0,
    0,
    0,
    0,
    0,
    0,
    0,
    0,
    0,
    0,
    0,
    0,
    0,
    0,
    0,
    0,
    0,
    0,
    0,
    0,
    0,
    0,
    0,
    0,
    0,
    0,
    0,
    0,
    0,
    0,
    0,
    0,
    0,
    0,
    0,
    0,
    0,
    0,
    0
  ],
  "objects": [
    {
      "id": "synthetic_card",
      "position_m": [
        0,
        0,
        0
      ],
      "rotation_xyzw": [
        0,
        0,
        0,
        1
      ],
      "visible": true,
      "enabled": true,
      "state": {
        "card_face": 0
      }
    }
  ]
}
